{
  "$schema": "../../../schemas/agent/v1/agent-credential-v1.schema.json",
  "schemaVersion": "1.0",
  "agentId": "7c9f1f62-02c8-49e7-8dbd-b0c9a87d2ddf",
  "agentName": "CareScheduler Agent",
  "agentVersion": "2.2.1",
  "agentDescription": "Schedules, reschedules, and cancels patient appointments within policy, synchronizing provider availability and sending HIPAA-aligned reminders with consent tracking.",
  "firstReleaseDate": "2021-05-12",
  "currentStatus": "production",
  "developerCredentialId": "6b39a923-8025-4bb1-9842-ccf3f1f7a8b1",
  "developerCredentialVerified": true,
  "primaryModelProvider": "OpenAI",
  "primaryModelFamily": "GPT-4.1",
  "modelContextWindow": 128000,
  "modalitySupport": ["text", "structured_data"],
  "languageCapabilities": ["en", "es"],
  "architectureType": "rag",
  "systemConfigFingerprint": "0bc7ad1bd2473b0c9a20fd8d6c8b76f77b6f7a9c1fb17a2fcbeb62d1c9e2c4af",
  "systemConfigLastUpdated": "2025-01-25",
  "deploymentEnvironment": "GCP us-central1 HIPAA-eligible, private service perimeter; DR in us-east1 cold standby",
  "complianceCertifications": ["hipaa", "soc2_type2"],
  "dataLocationProfile": {
    "storageRegions": ["US"],
    "processingRegions": ["US"],
    "backupRegions": ["US"],
    "notes": "All PHI remains in US regions under BAA; exports blocked by egress firewall"
  },
  "toolsList": [
    {
      "toolId": "read_emr",
      "toolName": "EMR Read",
      "toolDescription": "Reads patient demographics, consent flags, and appointment history from the EMR via FHIR APIs.",
      "riskCategory": "data",
      "riskSubcategory": "data_read_internal",
      "requiresAuth": true,
      "requiresHumanApproval": false,
      "mitigations": "FHIR scopes limited to schedule resources; PHI masking in prompts; access tokens short-lived"
    },
    {
      "toolId": "schedule_visit",
      "toolName": "Schedule/Reschedule Visit",
      "toolDescription": "Creates or updates appointment slots across providers and locations with policy checks for referral and insurance requirements.",
      "riskCategory": "compute",
      "riskSubcategory": "compute_api_call",
      "requiresAuth": true,
      "requiresHumanApproval": true,
      "mitigations": "Pre-checks for consent + insurance; human approval for cancellations inside 24h; change log sent to front desk"
    },
    {
      "toolId": "send_reminder",
      "toolName": "Patient Notifications",
      "toolDescription": "Sends SMS/email reminders and pre-visit instructions using templated content.",
      "riskCategory": "external",
      "riskSubcategory": "external_notification",
      "requiresAuth": true,
      "requiresHumanApproval": false,
      "mitigations": "Templates locked; no freeform text; opt-out respected per patient preferences"
    }
  ],
  "toolsLastAudited": "2025-01-27",
  "dataCategoriesProcessed": ["phi", "pii", "authentication", "behavioral"],
  "dataRetentionMaxPeriod": "P30D",
  "dataRetentionByCategory": {
    "phi": "P30D",
    "pii": "P30D",
    "authentication": "P7D",
    "behavioral": "P14D",
    "logs": "P30D"
  },
  "trainingDataUsage": "anonymized_only",
  "piiDetectionEnabled": true,
  "piiRedactionCapability": "context_aware",
  "piiRedactionPipeline": "PHI classifier at ingress; context-aware redaction before storage; outbound reminders filtered for minimum necessary",
  "dataEncryptionStandards": [
    "AES-256 at rest",
    "TLS 1.3 in transit",
    "Field-level encryption for PHI"
  ],
  "harmfulContentRefusalScore": 96,
  "harmfulContentBenchmarkName": "Beltic Harmful Content Suite",
  "harmfulContentBenchmarkVersion": "2.0.1",
  "harmfulContentEvaluationDate": "2025-02-04",
  "harmfulContentAssuranceSource": "beltic",
  "promptInjectionRobustnessScore": 91,
  "promptInjectionBenchmarkName": "Beltic Prompt Injection Suite",
  "promptInjectionBenchmarkVersion": "1.3.0",
  "promptInjectionEvaluationDate": "2025-02-04",
  "promptInjectionAssuranceSource": "beltic",
  "toolAbuseRobustnessScore": 87,
  "toolAbuseBenchmarkName": "Beltic Tool Safety Suite",
  "toolAbuseBenchmarkVersion": "1.1.0",
  "toolAbuseEvaluationDate": "2025-02-05",
  "toolAbuseAssuranceSource": "beltic",
  "piiLeakageRobustnessScore": 90,
  "piiLeakageBenchmarkName": "Beltic Privacy Leakage Suite",
  "piiLeakageBenchmarkVersion": "1.2.0",
  "piiLeakageEvaluationDate": "2025-02-04",
  "piiLeakageAssuranceSource": "beltic",
  "incidentResponseContact": "security@wellpointscheduling.example",
  "incidentResponseSLO": "PT1H",
  "deprecationPolicy": "Provide 45-day notice; freeze new features during cutover; archive manifests for audit for 12 months.",
  "updateCadence": "monthly",
  "humanOversightMode": "human_review_pre_action",
  "failSafeBehavior": "If insurance/referral checks fail or consent missing, halt changes and route to front-desk queue; disable reminders when preference flags are unclear; lock tool calls after 3 denied attempts in a session.",
  "monitoringCoverage": "PHI access logged to SIEM; anomaly alerts on cross-tenant queries; weekly manual review of 5% of scheduling actions; HIPAA audit feed retained 30 days.",
  "credentialIssuanceDate": "2025-02-07T09:00:00Z",
  "credentialExpirationDate": "2025-08-07T09:00:00Z",
  "overallSafetyRating": "moderate_risk",
  "approvedUseCases": [
    "Outpatient appointment scheduling",
    "Rescheduling and cancellations",
    "Consent-aware reminders"
  ],
  "prohibitedUseCases": [
    "Clinical triage or diagnosis",
    "Prescription management",
    "Insurance appeals"
  ],
  "ageRestrictions": "18+",
  "kybTierRequired": "tier_3",
  "verificationLevel": "beltic_verified",
  "lastSecurityAuditDate": "2024-12-10",
  "credentialId": "cbb22f6c-2933-497d-91d8-7363f88a1747",
  "issuerDid": "did:web:beltic.test",
  "verificationMethod": "did:web:beltic.test#agent-key-2",
  "credentialStatus": "active",
  "revocationListUrl": "https://beltic.test/status/agents",
  "proof": {
    "type": "Ed25519Signature2020",
    "created": "2025-02-07T09:00:00Z",
    "verificationMethod": "did:web:beltic.test#agent-key-2",
    "proofPurpose": "assertionMethod",
    "proofValue": "zBelticSignatureExampleCareScheduler"
  }
}
